postgres=> \l
postgres=>                                    List of databases
+----------------+--------------+----------+---------+---------+-----------------------+
|      Name      |    Owner     | Encoding | Collate |  Ctype  |   Access privileges   |
+----------------+--------------+----------+---------+---------+-----------------------+
| mario_database | freecodecamp | UTF8     | C.UTF-8 | C.UTF-8 |                       |
| postgres       | postgres     | UTF8     | C.UTF-8 | C.UTF-8 |                       |
| template0      | postgres     | UTF8     | C.UTF-8 | C.UTF-8 | =c/postgres          +|
|                |              |          |         |         | postgres=CTc/postgres |
| template1      | postgres     | UTF8     | C.UTF-8 | C.UTF-8 | =c/postgres          +|
|                |              |          |         |         | postgres=CTc/postgres |
+----------------+--------------+----------+---------+---------+-----------------------+
(4 rows)

\d          c mario_database;
SSL connection (protocol: TLSv1.3, cipher: TLS_AES_256_GCM_SHA384, bits: 256, compression: off)
You are now connected to database "mario_database" as user "freecodecamp".
mario_database=> \d
mario_database=>                         List of relations
+--------+-----------------------------+----------+--------------+
| Schema |            Name             |   Type   |    Owner     |
+--------+-----------------------------+----------+--------------+
| public | characters                  | table    | freecodecamp |
| public | characters_character_id_seq | sequence | freecodecamp |
+--------+-----------------------------+----------+--------------+
(2 rows)

\d characters
mario_database=>                                      Table "public.characters"
+--------------+---------+-----------+----------+--------------------------------------------------+
|    Column    |  Type   | Collation | Nullable |                     Default                      |
+--------------+---------+-----------+----------+--------------------------------------------------+
| character_id | integer |           | not null | nextval('characters_character_id_seq'::regclass) |
+--------------+---------+-----------+----------+--------------------------------------------------+

ALTER TABLE characters ADD COLUMN name VARCHAR(30) NOT NULL;
mario_database=> ALTER TABLE
ALTER TABLE characters ADD COLUMN homeland VARCHAR(60);
ALTER TABLE
mario_database=> ALTER TABLE characters ADD COLUMN favorite_color VARCHAR(30);
mario_database=> ALTER TABLE
\d characters
mario_database=>                                              Table "public.characters"
+----------------+-----------------------+-----------+----------+--------------------------------------------------+
|     Column     |         Type          | Collation | Nullable |                     Default                      |
+----------------+-----------------------+-----------+----------+--------------------------------------------------+
| character_id   | integer               |           | not null | nextval('characters_character_id_seq'::regclass) |
| name           | character varying(30) |           | not null |                                                  |
| homeland       | character varying(60) |           |          |                                                  |
| favorite_color | character varying(30) |           |          |                                                  |
+----------------+-----------------------+-----------+----------+--------------------------------------------------+

INSERT INTO characters(name, homeland, favorite_color) VALUES('Mario', 'Mushroom Kingdom', 'Red');
INSERT 0 1
mario_database=> SELECT * FROM characters;
mario_database=>                               
+--------------+-------+------------------+----------------+
| character_id | name  |     homeland     | favorite_color |
+--------------+-------+------------------+----------------+
|            1 | Mario | Mushroom Kingdom | Red            |
+--------------+-------+------------------+----------------+
(1 row)

INSERT INTO characters(name, homeland, favorite_color) VALUES('Luigi', 'Mushroom Kingdom', 'Green');
INSERT 0 1
mario_database=> SELECT * FROM characters;
                              
+--------------+-------+------------------+----------------+
| character_id | name  |     homeland     | favorite_color |
+--------------+-------+------------------+----------------+
|            1 | Mario | Mushroom Kingdom | Red            |
|            2 | Luigi | Mushroom Kingdom | Green          |
+--------------+-------+------------------+----------------+
(2 rows)

mario_database=> INSERT INTO characters(name, homeland, favorite_color) VALUES('Peach', 'Mushroom Kingdom', 'Pink');
INSERT 0 1
mario_database=> INSERT INTO characters(name, homeland, favorite_color) VALUES('Toadstool', 'Mushroom Kingdom', 'Red'), ('Bowser', Mushroom Kingdom', 'Green');
mario_database=> SELECT * FROM characters;
mario_database=>                                 
+--------------+-----------+------------------+----------------+
| character_id |   name    |     homeland     | favorite_color |
+--------------+-----------+------------------+----------------+
|            1 | Mario     | Mushroom Kingdom | Red            |
|            2 | Luigi     | Mushroom Kingdom | Green          |
|            3 | Peach     | Mushroom Kingdom | Pink           |
|            4 | Toadstool | Mushroom Kingdom | Red            |
|            5 | Bowser    | Mushroom Kingdom | Green          |
|            6 | Daisy     | Sarasaland       | Yellow         |
|            7 | Yoshi     | Dinosaur Land    | Green          |
+--------------+-----------+------------------+----------------+
(7 rows)

P
mario_database=> UPDATE characters SET favorite_color = 'Orange' WHERE name = 'Daisy';
mario_database=> UPDATE 1
SELECT * FROM characters;
                                
+--------------+-----------+------------------+----------------+
| character_id |   name    |     homeland     | favorite_color |
+--------------+-----------+------------------+----------------+
|            1 | Mario     | Mushroom Kingdom | Red            |
|            2 | Luigi     | Mushroom Kingdom | Green          |
|            3 | Peach     | Mushroom Kingdom | Pink           |
|            4 | Toadstool | Mushroom Kingdom | Red            |
|            5 | Bowser    | Mushroom Kingdom | Green          |
|            7 | Yoshi     | Dinosaur Land    | Green          |
|            6 | Daisy     | Sarasaland       | Orange         |
+--------------+-----------+------------------+----------------+
(7 rows)

mario_database=> UPDATE characters SET name = 'Toad' WHERE character_id = 4;
UPDATE 1
mario_database=> SELECT * FROM characters;
mario_database=>                                
+--------------+--------+------------------+----------------+
| character_id |  name  |     homeland     | favorite_color |
+--------------+--------+------------------+----------------+
|            1 | Mario  | Mushroom Kingdom | Red            |
|            2 | Luigi  | Mushroom Kingdom | Green          |
|            3 | Peach  | Mushroom Kingdom | Pink           |
|            5 | Bowser | Mushroom Kingdom | Green          |
|            7 | Yoshi  | Dinosaur Land    | Green          |
|            6 | Daisy  | Sarasaland       | Orange         |
|            4 | Toad   | Mushroom Kingdom | Red            |
+--------------+--------+------------------+----------------+
(7 rows)

UPDATE characters SET name = 'Toad' WHERE favorite_color='Red'
mario_database-> ;
mario_database=> UPDATE 2
SELECT * FROM characters;
mario_database=>                                
+--------------+--------+------------------+----------------+
| character_id |  name  |     homeland     | favorite_color |
+--------------+--------+------------------+----------------+
|            2 | Luigi  | Mushroom Kingdom | Green          |
|            3 | Peach  | Mushroom Kingdom | Pink           |
|            5 | Bowser | Mushroom Kingdom | Green          |
|            7 | Yoshi  | Dinosaur Land    | Green          |
|            6 | Daisy  | Sarasaland       | Orange         |
|            1 | Toad   | Mushroom Kingdom | Red            |
|            4 | Toad   | Mushroom Kingdom | Red            |
+--------------+--------+------------------+----------------+
(7 rows)

UPDATE characters SET name = 'Mario' WHERE character_id = 1;
UPDATE 1
mario_database=> SELECT * FROM characters;
                               
+--------------+--------+------------------+----------------+
| character_id |  name  |     homeland     | favorite_color |
+--------------+--------+------------------+----------------+
|            2 | Luigi  | Mushroom Kingdom | Green          |
|            3 | Peach  | Mushroom Kingdom | Pink           |
|            5 | Bowser | Mushroom Kingdom | Green          |
|            7 | Yoshi  | Dinosaur Land    | Green          |
|            6 | Daisy  | Sarasaland       | Orange         |
|            4 | Toad   | Mushroom Kingdom | Red            |
|            1 | Mario  | Mushroom Kingdom | Red            |
+--------------+--------+------------------+----------------+
(7 rows)

mario_database=> UPDATE character SET favorite_color = 'Blue' WHERE character_id = 4;
ERROR:  relation "character" does not exist
LINE 1: UPDATE character SET favorite_color = 'Blue' WHERE character...
               ^
mario_database=> UPDATE characters SET favorite_color = 'Blue' WHERE character_id = 4;
UPDATE 1
mario_database=> UPDATE characters
mario_database-> SET favorite_color = 'Yellow'
mario_database-> WHERE character_id = 5;
mario_database=> UPDATE 1
UPDATE characters SET homeland = 'Koopa Kingdom' WHERE character_id = 5;
UPDATE 1
mario_database=> SELECT * FROM characters;
mario_database=>                                
+--------------+--------+------------------+----------------+
| character_id |  name  |     homeland     | favorite_color |
+--------------+--------+------------------+----------------+
|            2 | Luigi  | Mushroom Kingdom | Green          |
|            3 | Peach  | Mushroom Kingdom | Pink           |
|            7 | Yoshi  | Dinosaur Land    | Green          |
|            6 | Daisy  | Sarasaland       | Orange         |
|            1 | Mario  | Mushroom Kingdom | Red            |
|            4 | Toad   | Mushroom Kingdom | Blue           |
|            5 | Bowser | Koopa Kingdom    | Yellow         |
+--------------+--------+------------------+----------------+
(7 rows)

SELECT * FROM characters ORDER BY character_id;
                               
+--------------+--------+------------------+----------------+
| character_id |  name  |     homeland     | favorite_color |
+--------------+--------+------------------+----------------+
|            1 | Mario  | Mushroom Kingdom | Red            |
|            2 | Luigi  | Mushroom Kingdom | Green          |
|            3 | Peach  | Mushroom Kingdom | Pink           |
|            4 | Toad   | Mushroom Kingdom | Blue           |
|            5 | Bowser | Koopa Kingdom    | Yellow         |
|            6 | Daisy  | Sarasaland       | Orange         |
|            7 | Yoshi  | Dinosaur Land    | Green          |
+--------------+--------+------------------+----------------+
(7 rows)

mario_database=> ALTER TABLE characters ADD PRIMARY KEY(character_id);
mario_database=> ALTER TABLE
\d characters
mario_database=>                                              Table "public.characters"
+----------------+-----------------------+-----------+----------+--------------------------------------------------+
|     Column     |         Type          | Collation | Nullable |                     Default                      |
+----------------+-----------------------+-----------+----------+--------------------------------------------------+
| character_id   | integer               |           | not null | nextval('characters_character_id_seq'::regclass) |
| name           | character varying(30) |           | not null |                                                  |
| homeland       | character varying(60) |           |          |                                                  |
| favorite_color | character varying(30) |           |          |                                                  |
+----------------+-----------------------+-----------+----------+--------------------------------------------------+
Indexes:
    "characters_pkey" PRIMARY KEY, btree (character_id)
mario_database=> CREATE TABLE more_info();
CREATE TABLE
mario_database=> \d
                        List of relations
+--------+-----------------------------+----------+--------------+
| Schema |            Name             |   Type   |    Owner     |
+--------+-----------------------------+----------+--------------+
| public | characters                  | table    | freecodecamp |
| public | characters_character_id_seq | sequence | freecodecamp |
| public | more_info                   | table    | freecodecamp |
+--------+-----------------------------+----------+--------------+
(3 rows)

mario_database=> \d characters;
                                             Table "public.characters"
+----------------+-----------------------+-----------+----------+--------------------------------------------------+
|     Column     |         Type          | Collation | Nullable |                     Default                      |
+----------------+-----------------------+-----------+----------+--------------------------------------------------+
| character_id   | integer               |           | not null | nextval('characters_character_id_seq'::regclass) |
| name           | character varying(30) |           | not null |                                                  |
| homeland       | character varying(60) |           |          |                                                  |
| favorite_color | character varying(30) |           |          |                                                  |
+----------------+-----------------------+-----------+----------+--------------------------------------------------+
Indexes:
    "characters_pkey" PRIMARY KEY, btree (character_id)

mario_database=> ALTER TABLE more_info ADD COLUMN more_info_id SERIAL;
ALTER TABLE                                 
mario_database=> ALTER TABLE more_info ADD PRIMARY KEY(more_info_id);
ALTER TABLE
mario_database=> \d
mario_database=>                         List of relations
+--------+-----------------------------+----------+--------------+
| Schema |            Name             |   Type   |    Owner     |
+--------+-----------------------------+----------+--------------+
| public | characters                  | table    | freecodecamp |
| public | characters_character_id_seq | sequence | freecodecamp |
| public | more_info                   | table    | freecodecamp |
| public | more_info_more_info_id_seq  | sequence | freecodecamp |
+--------+-----------------------------+----------+--------------+
(4 rows)

ALTER TABLE more_info ADD COLUMN birthday DATE;
mario_database=> ALTER TABLE
ALTER TABLE more_info ADD COLUMN height INT;
ALTER TABLE
mario_database=> ALTER TABLE more_info ADD COLUMN weight NUMERIC(4, 1);
ALTER TABLE
mario_database=> \d more_info;
                                        Table "public.more_info"
+--------------+--------------+-----------+----------+-------------------------------------------------+
|    Column    |     Type     | Collation | Nullable |                     Default                     |
+--------------+--------------+-----------+----------+-------------------------------------------------+
| more_info_id | integer      |           | not null | nextval('more_info_more_info_id_seq'::regclass) |
| birthday     | date         |           |          |                                                 |
| height       | integer      |           |          |                                                 |
| weight       | numeric(4,1) |           |          |                                                 |
+--------------+--------------+-----------+----------+-------------------------------------------------+
Indexes:
    "more_info_pkey" PRIMARY KEY, btree (more_info_id)
mario_database=> ALTER TABLE more_info ADD COLUMN character_id INT REFERENCES characters(character_id);
ALTER TABLE
mario_database=> \d more_info;
mario_database=>                                         Table "public.more_info"
+--------------+--------------+-----------+----------+-------------------------------------------------+
|    Column    |     Type     | Collation | Nullable |                     Default                     |
+--------------+--------------+-----------+----------+-------------------------------------------------+
| more_info_id | integer      |           | not null | nextval('more_info_more_info_id_seq'::regclass) |
| birthday     | date         |           |          |                                                 |
| height       | integer      |           |          |                                                 |
| weight       | numeric(4,1) |           |          |                                                 |
| character_id | integer      |           |          |                                                 |
+--------------+--------------+-----------+----------+-------------------------------------------------+
Indexes:
    "more_info_pkey" PRIMARY KEY, btree (more_info_id)
Foreign-key constraints:
    "more_info_character_id_fkey" FOREIGN KEY (character_id) REFERENCES characters(character_id)

ALTER TABLE more_info ADD UNIQUE(character_id);
mario_database=> ALTER TABLE
ALTER TABLE more_info ALTER COLUMN character_id SET NOT NULL;
mario_database=> ALTER TABLE
\d more_info;
mario_database=>                                         Table "public.more_info"
+--------------+--------------+-----------+----------+-------------------------------------------------+
|    Column    |     Type     | Collation | Nullable |                     Default                     |
+--------------+--------------+-----------+----------+-------------------------------------------------+
| more_info_id | integer      |           | not null | nextval('more_info_more_info_id_seq'::regclass) |
| birthday     | date         |           |          |                                                 |
| height       | integer      |           |          |                                                 |
| weight       | numeric(4,1) |           |          |                                                 |
| character_id | integer      |           | not null |                                                 |
+--------------+--------------+-----------+----------+-------------------------------------------------+
Indexes:
    "more_info_pkey" PRIMARY KEY, btree (more_info_id)
    "more_info_character_id_key" UNIQUE CONSTRAINT, btree (character_id)
Foreign-key constraints:
    "more_info_character_id_fkey" FOREIGN KEY (character_id) REFERENCES characters(character_id)

SELECT character_id FROM characters;
mario_database=>         
+--------------+
| character_id |
+--------------+
|            2 |
|            3 |
|            7 |
|            6 |
|            1 |
|            4 |
|            5 |
+--------------+
(7 rows)

SELECT character_id, name FROM characters;
             
+--------------+--------+
| character_id |  name  |
+--------------+--------+
|            2 | Luigi  |
|            3 | Peach  |
|            7 | Yoshi  |
|            6 | Daisy  |
|            1 | Mario  |
|            4 | Toad   |
|            5 | Bowser |
+--------------+--------+
(7 rows)
mario_database=> INSERT INTO more_info(birthday, height, weight, character_id) VALUES('1981-07-09', 155, 64.5, 1);
INSERT 0 1
mario_database=> SELECT * FROM more_info;
mario_database=>                                
+--------------+------------+--------+--------+--------------+
| more_info_id |  birthday  | height | weight | character_id |
+--------------+------------+--------+--------+--------------+
|            2 | 1981-07-09 |    155 |   64.5 |            1 |
+--------------+------------+--------+--------+--------------+
(1 row)

mario_database=> UPDATE more_info SET more_info_id = 1 WHERE height = 155;
UPDATE 1
mario_database=> SELECT * FROM more_info;
                               
+--------------+------------+--------+--------+--------------+
| more_info_id |  birthday  | height | weight | character_id |
+--------------+------------+--------+--------+--------------+
|            1 | 1981-07-09 |    155 |   64.5 |            1 |
+--------------+------------+--------+--------+--------------+
(1 row)
                                              ^
mario_database=> UPDATE more_info SET more_info_id = 2 WHERE height = 155;
UPDATE 1
mario_database=> SELECT * FROM more_info;
                               
+--------------+------------+--------+--------+--------------+
| more_info_id |  birthday  | height | weight | character_id |
+--------------+------------+--------+--------+--------------+
|            2 | 1981-07-09 |    155 |   64.5 |            1 |
+--------------+------------+--------+--------+--------------+
(1 row)

mario_database=> SELECT character_id, name FROM characters;
mario_database=>              
+--------------+--------+
| character_id |  name  |
+--------------+--------+
|            2 | Luigi  |
|            3 | Peach  |
|            7 | Yoshi  |
|            6 | Daisy  |
|            1 | Mario  |
|            4 | Toad   |
|            5 | Bowser |
+--------------+--------+
(7 rows)

INSERT INTO more_info(birthday, height, weight, character_id) VALUES('1983-07-14', 175, 48.8, 2);
mario_database=> INSERT 0 1
SELECT * FROM more_info;
mario_database=>                                
+--------------+------------+--------+--------+--------------+
| more_info_id |  birthday  | height | weight | character_id |
+--------------+------------+--------+--------+--------------+
|            2 | 1981-07-09 |    155 |   64.5 |            1 |
|            3 | 1983-07-14 |    175 |   48.8 |            2 |
+--------------+------------+--------+--------+--------------+
(2 rows)

INSERT INTO more_
mario_database=> SELECT character_id, name FROM characters;
mario_database=>              
+--------------+--------+
| character_id |  name  |
+--------------+--------+
|            2 | Luigi  |
|            3 | Peach  |
|            7 | Yoshi  |
|            6 | Daisy  |
|            1 | Mario  |
|            4 | Toad   |
|            5 | Bowser |
+--------------+--------+
(7 rows)

INSERT INTO more_info(birthday, height, weight, character_id) VALUES('1985-10-18', 173, 52.2, 3);
INSERT 0 1
mario_database=> SELECT character_id, name FROM characters WHERE name = 'Toad';
            
+--------------+------+
| character_id | name |
+--------------+------+
|            4 | Toad |
+--------------+------+
(1 row)

mario_database=> INSERT INTO more_info(birthday, height, weight, character_id) VALUES('1950-01-10', 66, 35.6, 4);
INSERT 0 1
mario_database=> SELECT * FROM more_info;
                               
+--------------+------------+--------+--------+--------------+
| more_info_id |  birthday  | height | weight | character_id |
+--------------+------------+--------+--------+--------------+
|            2 | 1981-07-09 |    155 |   64.5 |            1 |
|            3 | 1983-07-14 |    175 |   48.8 |            2 |
|            4 | 1985-10-18 |    173 |   52.2 |            3 |
|            5 | 1950-01-10 |     66 |   35.6 |            4 |
+--------------+------------+--------+--------+--------------+
(4 rows)

mario_database=> SELECT character_id, name FROM characters WHERE name = 'Bowser';
             
+--------------+--------+
| character_id |  name  |
+--------------+--------+
|            5 | Bowser |
+--------------+--------+
(1 row)

mario_database=> INSERT INTO more_info(birthday, height, weight, character_id) VALUES('1990-10-29', 258, 300, 5);
INSERT 0 1
mario_database=> SELECT character_id, name FROM characters WHERE name = 'Daisy';
mario_database=>             
+--------------+-------+
| character_id | name  |
+--------------+-------+
|            6 | Daisy |
+--------------+-------+
(1 row)

INSERT INTO more_info(birthday, height, weight, character_id) VALUES('1989-07-31', NULL, NULL, 6);
INSERT 0 1
mario_database=> SELECT * FROM more_info;
mario_database=>                                
+--------------+------------+--------+--------+--------------+
| more_info_id |  birthday  | height | weight | character_id |
+--------------+------------+--------+--------+--------------+
|            2 | 1981-07-09 |    155 |   64.5 |            1 |
|            3 | 1983-07-14 |    175 |   48.8 |            2 |
|            4 | 1985-10-18 |    173 |   52.2 |            3 |
|            5 | 1950-01-10 |     66 |   35.6 |            4 |
|            6 | 1990-10-29 |    258 |  300.0 |            5 |
|            7 | 1989-07-31 |        |        |            6 |
+--------------+------------+--------+--------+--------------+
(6 rows)

SELECT character_id, name FROM characters WHERE name = 'Yoshi';
mario_database=>             
+--------------+-------+
| character_id | name  |
+--------------+-------+
|            7 | Yoshi |
+--------------+-------+
(1 row)

INSERT INTO more_info(birthday, height, weight, character_id) VALUES('1990-04-13', 162, 59.1, 7);
mario_database=> INSERT 0 1
SELECT * FROM more_info;
mario_database=>                                
+--------------+------------+--------+--------+--------------+
| more_info_id |  birthday  | height | weight | character_id |
+--------------+------------+--------+--------+--------------+
|            2 | 1981-07-09 |    155 |   64.5 |            1 |
|            3 | 1983-07-14 |    175 |   48.8 |            2 |
|            4 | 1985-10-18 |    173 |   52.2 |            3 |
|            5 | 1950-01-10 |     66 |   35.6 |            4 |
|            6 | 1990-10-29 |    258 |  300.0 |            5 |
|            7 | 1989-07-31 |        |        |            6 |
|            8 | 1990-04-13 |    162 |   59.1 |            7 |
+--------------+------------+--------+--------+--------------+
(7 rows)                                        ^
mario_database=> ALTER TABLE more_info RENAME height TO height_in_cm;
mario_database=> ALTER TABLE
ALTER TABLE more_info RENAME weight TO weight_in_kg;
ALTER TABLE
mario_database=> SELECT * FROM more_info;
                                     
+--------------+------------+--------------+--------------+--------------+
| more_info_id |  birthday  | height_in_cm | weight_in_kg | character_id |
+--------------+------------+--------------+--------------+--------------+
|            2 | 1981-07-09 |          155 |         64.5 |            1 |
|            3 | 1983-07-14 |          175 |         48.8 |            2 |
|            4 | 1985-10-18 |          173 |         52.2 |            3 |
|            5 | 1950-01-10 |           66 |         35.6 |            4 |
|            6 | 1990-10-29 |          258 |        300.0 |            5 |
|            7 | 1989-07-31 |              |              |            6 |
|            8 | 1990-04-13 |          162 |         59.1 |            7 |
+--------------+------------+--------------+--------------+--------------+
(7 rows)
mario_database=> CREATE TABLE sounds(sound_id SERIAL PRIMARY KEY);
CREATE TABLE
mario_database=>                         List of relations
+--------+-----------------------------+----------+--------------+
| Schema |            Name             |   Type   |    Owner     |
+--------+-----------------------------+----------+--------------+
| public | characters                  | table    | freecodecamp |
| public | characters_character_id_seq | sequence | freecodecamp |
| public | more_info                   | table    | freecodecamp |
| public | more_info_more_info_id_seq  | sequence | freecodecamp |
| public | sounds                      | table    | freecodecamp |
| public | sounds_sound_id_seq         | sequence | freecodecamp |
+--------+-----------------------------+----------+--------------+
(6 rows)

ALTER TABLE sound
mario_database=> ALTER TABLE sounds ADD COLUMN filename VARCHAR(40) NOT NULL UNIQUE;
ALTER TABLE
